{
  "generatedAt": "2026-01-25T12:00:00.000Z",
  "version": "1.0.0",
  "description": "Keyword-to-skill mappings for automatic skill suggestions in /create-backlog and /add-story",
  "defaultSkills": [
    "anti-pattern-analysis",
    "codebase-analysis",
    "command-spec-audit",
    "drawio-generation",
    "error-handling-patterns",
    "tdd-failure-recovery",
    "tdd-green-phase",
    "tdd-red-phase",
    "tdd-refactor-phase",
    "test-writing-patterns"
  ],
  "skillKeywords": {
    "anti-pattern-analysis": [
      "anti-pattern",
      "code smell",
      "technical debt",
      "code review",
      "design pattern violation",
      "refactoring",
      "spaghetti code",
      "god class",
      "coupling",
      "javascript anti-pattern",
      "python anti-pattern"
    ],
    "api-versioning": [
      "api version",
      "versioning",
      "backward compatible",
      "deprecate api",
      "api migration",
      "api compatibility"
    ],
    "astro-development": [
      "astro",
      "astro.build",
      "islands architecture",
      "content collections",
      "partial hydration",
      "client:load",
      "client:idle",
      "client:visible",
      "astro component",
      "static site generator",
      "ssg framework",
      "astro adapter",
      "view transitions"
    ],
    "bdd-writing": [
      "bdd",
      "behavior-driven",
      "gherkin",
      "cucumber",
      "feature file",
      "given-when-then",
      "acceptance test"
    ],
    "beginner-testing": [
      "learn testing",
      "testing basics",
      "first test",
      "intro to testing",
      "how to test",
      "unit test beginner",
      "pytest tutorial",
      "jest tutorial",
      "flask testing",
      "sinatra testing"
    ],
    "ci-cd-pipeline-design": [
      "ci/cd",
      "cicd",
      "pipeline",
      "github actions",
      "jenkins",
      "gitlab ci",
      "continuous integration",
      "continuous deployment",
      "build automation"
    ],
    "code-path-discovery": [
      "code paths",
      "path discovery",
      "behavioral paths",
      "route analysis",
      "handler analysis",
      "from code",
      "code flow",
      "exception paths",
      "guard clauses"
    ],
    "codebase-analysis": [
      "analyze codebase",
      "code analysis",
      "architecture review",
      "understand codebase",
      "code audit",
      "legacy code",
      "onboarding",
      "code exploration",
      "tech stack detection",
      "nfr detection"
    ],
    "command-spec-audit": [
      "command spec",
      "command quality",
      "extension point",
      "command audit",
      "spec review"
    ],
    "common-errors": [
      "troubleshoot",
      "common error",
      "fix error",
      "error message",
      "debugging guide",
      "why isn't this working",
      "crash",
      "exception",
      "stack trace",
      "flask error",
      "sinatra error"
    ],
    "digitalocean-app-setup": [
      "digitalocean",
      "digital ocean",
      "app platform",
      "doctl",
      "app spec",
      "digitalocean deploy",
      "do app platform"
    ],
    "drawio-generation": [
      "drawio",
      "diagram",
      "architecture diagram",
      "flowchart",
      "sequence diagram",
      "xml diagram",
      "draw.io"
    ],
    "electron-development": [
      "electron",
      "desktop app",
      "desktop application",
      "ipc",
      "main process",
      "renderer process",
      "cross-platform desktop",
      "native desktop",
      "deb",
      "packaging",
      "linux build",
      "electron-builder",
      "docker build",
      "autoUpdater",
      "code signing",
      "notarize",
      "dmg",
      "appimage",
      "snap",
      "electron-fuses",
      "multi-screen"
    ],
    "error-handling-patterns": [
      "error handling",
      "exception handling",
      "retry logic",
      "circuit breaker",
      "fallback",
      "error recovery",
      "graceful degradation"
    ],
    "flask-setup": [
      "flask",
      "python web",
      "werkzeug",
      "jinja2",
      "flask app",
      "python api",
      "flask tutorial",
      "flask beginner",
      "python web server"
    ],
    "migration-patterns": [
      "database migration",
      "schema migration",
      "flyway",
      "alembic",
      "prisma migrate",
      "db migration",
      "schema change"
    ],
    "mutation-testing": [
      "mutation testing",
      "mutant",
      "test quality",
      "stryker",
      "mutmut",
      "pit mutation"
    ],
    "playwright-explorer": [
      "playwright",
      "browser exploration",
      "dom inspection",
      "interactive browser",
      "browser session",
      "live browser",
      "dom reader"
    ],
    "playwright-setup": [
      "playwright",
      "e2e test",
      "e2e testing",
      "end-to-end test",
      "browser test",
      "browser automation",
      "ui test"
    ],
    "privacy-compliance": [
      "privacy",
      "gdpr",
      "ccpa",
      "consent management",
      "cookie compliance",
      "cookie banner",
      "dark pattern",
      "data protection",
      "privacy policy",
      "opt-in",
      "opt-out",
      "consent",
      "eprivacy",
      "lgpd",
      "do not sell"
    ],
    "postgresql-integration": [
      "postgres",
      "postgresql",
      "pg_",
      "psql",
      "postgres database",
      "connection pool",
      "pgbouncer",
      "sequelize postgres",
      "prisma postgres",
      "database setup"
    ],
    "property-based-testing": [
      "property-based",
      "property based testing",
      "hypothesis",
      "quickcheck",
      "fast-check",
      "generative testing"
    ],
    "railway-project-setup": [
      "railway",
      "railway app",
      "railway deploy",
      "railway.toml",
      "nixpacks",
      "railway hosting"
    ],
    "render-project-setup": [
      "render",
      "render deploy",
      "render.yaml",
      "render blueprint",
      "render hosting",
      "render web service"
    ],
    "resilience-patterns": [
      "retry",
      "circuit breaker",
      "fallback",
      "bulkhead",
      "timeout pattern",
      "fault tolerance",
      "graceful degradation",
      "exponential backoff",
      "cascading failure"
    ],
    "seo-optimization": [
      "seo",
      "search engine optimization",
      "meta tags",
      "structured data",
      "json-ld",
      "sitemap",
      "robots.txt",
      "canonical url",
      "open graph",
      "twitter cards",
      "heading hierarchy",
      "semantic html",
      "internal linking",
      "search ranking"
    ],
    "sinatra-setup": [
      "sinatra",
      "ruby web",
      "rack app",
      "sinatra app",
      "ruby api",
      "sinatra tutorial",
      "sinatra beginner",
      "ruby web server"
    ],
    "sqlite-integration": [
      "sqlite",
      "sqlite3",
      "embedded database",
      "local database",
      "save data",
      "persist data",
      "file database",
      "database beginner",
      "better-sqlite3"
    ],
    "tdd-failure-recovery": [
      "test failure",
      "failing test recovery",
      "test rollback",
      "broken test",
      "flaky test",
      "test passes unexpectedly",
      "test still fails",
      "intermittent test"
    ],
    "tdd-green-phase": [
      "green phase",
      "make test pass",
      "minimal implementation",
      "pass the test"
    ],
    "tdd-red-phase": [
      "red phase",
      "failing test first",
      "write test first",
      "test first"
    ],
    "tdd-refactor-phase": [
      "refactor phase",
      "refactoring",
      "clean up code",
      "improve design"
    ],
    "test-writing-patterns": [
      "test pattern",
      "aaa pattern",
      "arrange act assert",
      "test double",
      "mock object",
      "stub",
      "spy",
      "test fixture"
    ],
    "vercel-project-setup": [
      "vercel",
      "vercel deploy",
      "vercel.json",
      "vercel hosting",
      "next.js deploy",
      "vercel preview"
    ]
  },
  "groupKeywords": {
    "deployment-platforms": {
      "keywords": [
        "deploy",
        "deployment platform",
        "hosting",
        "cloud deploy",
        "preview deployment",
        "production deploy"
      ],
      "skills": [
        "digitalocean-app-setup",
        "railway-project-setup",
        "render-project-setup",
        "vercel-project-setup"
      ]
    },
    "tdd": {
      "keywords": [
        "tdd",
        "test-driven",
        "test driven development",
        "red-green-refactor"
      ],
      "skills": [
        "tdd-red-phase",
        "tdd-green-phase",
        "tdd-refactor-phase",
        "tdd-failure-recovery",
        "test-writing-patterns"
      ]
    }
  },
  "_schema": {
    "defaultSkills": "Array of skill names to auto-install for all projects regardless of tech stack. These are universally applicable skills (development infrastructure, code review, TDD methodology). Merged before keyword matching in /charter; re-added on /charter refresh.",
    "skillKeywords": "Map of skill-name to array of keywords that indicate the skill is relevant",
    "groupKeywords": "Keywords that suggest multiple related skills as a group"
  }
}
